{
  "$schema": "https://json-schema.org/draft/2020-12/schema",
  "$id": "https://tretnix.com/schemas/tretnix-evidence.schema.json",
  "title": "Tretnix Validation Evidence",
  "type": "object",
  "additionalProperties": false,
  "required": [
    "schema_version",
    "run_id",
    "started_at",
    "ended_at",
    "repository",
    "branch",
    "head",
    "fingerprint",
    "fingerprint_contract_version",
    "task_class",
    "preflight",
    "context",
    "working_tree",
    "sources",
    "validation_plan",
    "commands",
    "cache",
    "validation",
    "automatic_gates",
    "manual_gates",
    "forbidden_actions_observed",
    "result",
    "state_identity"
  ],
  "properties": {
    "$schema": {
      "type": "string"
    },
    "schema_version": {
      "const": 1
    },
    "run_id": {
      "type": "string",
      "pattern": "^[0-9A-Za-z._-]+$"
    },
    "started_at": {
      "type": "string",
      "format": "date-time",
      "pattern": "^\\d{4}-\\d{2}-\\d{2}T\\d{2}:\\d{2}:\\d{2}(?:\\.\\d+)?Z$"
    },
    "ended_at": {
      "type": "string",
      "format": "date-time",
      "pattern": "^\\d{4}-\\d{2}-\\d{2}T\\d{2}:\\d{2}:\\d{2}(?:\\.\\d+)?Z$"
    },
    "repository": {
      "type": "string",
      "minLength": 1,
      "pattern": "\\S"
    },
    "branch": {
      "type": "string",
      "minLength": 1,
      "pattern": "\\S"
    },
    "head": {
      "type": "string",
      "pattern": "^[0-9a-f]{40}$"
    },
    "fingerprint": {
      "type": "string",
      "pattern": "^[0-9a-f]{64}$"
    },
    "fingerprint_contract_version": {
      "type": "string",
      "minLength": 1,
      "pattern": "\\S"
    },
    "task_class": {
      "enum": [
        "docs_only",
        "frontend",
        "backend",
        "security_or_data",
        "release_or_infra"
      ]
    },
    "preflight": {
      "type": "object",
      "additionalProperties": false,
      "required": [
        "ok",
        "issues"
      ],
      "properties": {
        "ok": {
          "type": "boolean"
        },
        "issues": {
          "type": "array",
          "items": {
            "$ref": "#/$defs/preflightIssue"
          }
        }
      }
    },
    "context": {
      "oneOf": [
        {
          "type": "null"
        },
        {
          "type": "object",
          "additionalProperties": false,
          "required": [
            "cache",
            "key",
            "source_count",
            "bytes",
            "lines"
          ],
          "properties": {
            "cache": {
              "enum": [
                "HIT",
                "MISS"
              ]
            },
            "key": {
              "type": "string",
              "pattern": "^[0-9a-f]{64}$"
            },
            "source_count": {
              "type": "integer",
              "minimum": 0
            },
            "bytes": {
              "type": "integer",
              "minimum": 0
            },
            "lines": {
              "type": "integer",
              "minimum": 0
            }
          }
        }
      ]
    },
    "working_tree": {
      "type": "object",
      "additionalProperties": false,
      "required": [
        "staged",
        "unstaged",
        "untracked",
        "sensitive"
      ],
      "properties": {
        "staged": {
          "type": "array",
          "uniqueItems": true,
          "items": {
            "$ref": "#/$defs/safePath"
          }
        },
        "unstaged": {
          "type": "array",
          "uniqueItems": true,
          "items": {
            "$ref": "#/$defs/safePath"
          }
        },
        "untracked": {
          "type": "array",
          "uniqueItems": true,
          "items": {
            "$ref": "#/$defs/safePath"
          }
        },
        "sensitive": {
          "type": "array",
          "uniqueItems": true,
          "items": {
            "$ref": "#/$defs/safePath"
          }
        }
      }
    },
    "sources": {
      "type": "array",
      "items": {
        "$ref": "#/$defs/source"
      }
    },
    "validation_plan": {
      "type": "object",
      "additionalProperties": false,
      "required": [
        "supported",
        "required_capabilities",
        "provided_capabilities",
        "missing_capabilities",
        "selected",
        "not_executed",
        "effective_classes"
      ],
      "properties": {
        "supported": {
          "type": "boolean"
        },
        "required_capabilities": {
          "$ref": "#/$defs/stringList"
        },
        "provided_capabilities": {
          "$ref": "#/$defs/stringList"
        },
        "missing_capabilities": {
          "$ref": "#/$defs/stringList"
        },
        "selected": {
          "$ref": "#/$defs/stringList"
        },
        "not_executed": {
          "type": "array",
          "items": {
            "$ref": "#/$defs/notExecuted"
          }
        },
        "effective_classes": {
          "type": "array",
          "minItems": 1,
          "uniqueItems": true,
          "items": {
            "enum": [
              "docs_only",
              "frontend",
              "backend",
              "security_or_data",
              "release_or_infra"
            ]
          }
        }
      }
    },
    "commands": {
      "type": "array",
      "items": {
        "$ref": "#/$defs/commandResult"
      }
    },
    "cache": {
      "type": "object",
      "additionalProperties": false,
      "required": [
        "context",
        "hits",
        "misses",
        "rejections"
      ],
      "properties": {
        "context": {
          "enum": [
            "HIT",
            "MISS",
            "NOT_RUN"
          ]
        },
        "hits": {
          "$ref": "#/$defs/stringList"
        },
        "misses": {
          "$ref": "#/$defs/stringList"
        },
        "rejections": {
          "$ref": "#/$defs/stringList"
        }
      }
    },
    "validation": {
      "type": "array",
      "items": {
        "$ref": "#/$defs/validatorResult"
      }
    },
    "automatic_gates": {
      "type": "array",
      "items": {
        "$ref": "#/$defs/gate"
      }
    },
    "manual_gates": {
      "type": "array",
      "items": {
        "$ref": "#/$defs/manualGate"
      }
    },
    "forbidden_actions_observed": {
      "$ref": "#/$defs/stringList"
    },
    "result": {
      "enum": [
        "PASS",
        "REVIEW_REQUIRED",
        "FAIL"
      ]
    },
    "state_identity": {
      "type": "object",
      "additionalProperties": false,
      "required": [
        "manifest_path",
        "manifest_sha256",
        "task_path",
        "task_sha256"
      ],
      "properties": {
        "manifest_path": {
          "$ref": "#/$defs/safePath"
        },
        "manifest_sha256": {
          "type": "string",
          "pattern": "^[0-9a-f]{64}$"
        },
        "task_path": {
          "oneOf": [
            {
              "type": "null"
            },
            {
              "$ref": "#/$defs/safePath"
            }
          ]
        },
        "task_sha256": {
          "type": [
            "string",
            "null"
          ],
          "pattern": "^[0-9a-f]{64}$"
        }
      }
    }
  },
  "$defs": {
    "stringList": {
      "type": "array",
      "uniqueItems": true,
      "items": {
        "type": "string",
        "minLength": 1,
        "pattern": "\\S"
      }
    },
    "nonEmptyStringList": {
      "type": "array",
      "minItems": 1,
      "uniqueItems": true,
      "items": {
        "type": "string",
        "minLength": 1,
        "pattern": "\\S"
      }
    },
    "safePath": {
      "type": "string",
      "minLength": 1,
      "pattern": "(?=.*\\S)(?!.*\\u0000)^(?![A-Za-z]:)(?![/\\\\])(?!.*(?:^|[/\\\\])\\.\\.(?:[/\\\\]|$)).+"
    },
    "preflightIssue": {
      "type": "object",
      "additionalProperties": false,
      "required": [
        "code"
      ],
      "properties": {
        "code": {
          "type": "string",
          "minLength": 1,
          "pattern": "\\S"
        },
        "expected": {
          "type": [
            "string",
            "null"
          ]
        },
        "actual": {
          "type": [
            "string",
            "null"
          ]
        },
        "paths": {
          "type": "array",
          "uniqueItems": true,
          "items": {
            "$ref": "#/$defs/safePath"
          }
        }
      }
    },
    "source": {
      "type": "object",
      "additionalProperties": false,
      "required": [
        "base",
        "path",
        "display_path",
        "sha256",
        "knowledge_commit",
        "headings",
        "reason"
      ],
      "properties": {
        "base": {
          "enum": [
            "repo",
            "knowledge"
          ]
        },
        "path": {
          "$ref": "#/$defs/safePath"
        },
        "display_path": {
          "type": "string",
          "minLength": 1,
          "pattern": "\\S"
        },
        "sha256": {
          "type": "string",
          "pattern": "^[0-9a-f]{64}$"
        },
        "knowledge_commit": {
          "oneOf": [
            {
              "type": "null"
            },
            {
              "type": "string",
              "pattern": "^[0-9a-f]{40}$"
            }
          ]
        },
        "headings": {
          "$ref": "#/$defs/stringList"
        },
        "reason": {
          "type": "string",
          "minLength": 1,
          "pattern": "\\S"
        }
      }
    },
    "notExecuted": {
      "type": "object",
      "additionalProperties": false,
      "required": [
        "validator_id",
        "reason"
      ],
      "properties": {
        "validator_id": {
          "type": "string",
          "minLength": 1,
          "pattern": "\\S"
        },
        "reason": {
          "type": "string",
          "minLength": 1,
          "pattern": "\\S"
        }
      }
    },
    "commandResult": {
      "type": "object",
      "additionalProperties": false,
      "required": [
        "validator_id",
        "command",
        "exit_code",
        "status"
      ],
      "properties": {
        "validator_id": {
          "type": "string",
          "minLength": 1,
          "pattern": "\\S"
        },
        "command": {
          "type": [
            "string",
            "null"
          ]
        },
        "exit_code": {
          "type": [
            "integer",
            "null"
          ]
        },
        "status": {
          "enum": [
            "PASS",
            "FAIL",
            "TIMEOUT",
            "UNAVAILABLE",
            "BLOCKED",
            "NOT_RUN"
          ]
        },
        "reason": {
          "type": "string",
          "minLength": 1,
          "pattern": "\\S"
        }
      }
    },
    "validatorResult": {
      "type": "object",
      "additionalProperties": false,
      "required": [
        "validator_id",
        "command",
        "capabilities",
        "exit_code",
        "result",
        "cache",
        "duration_ms",
        "cache_rejection"
      ],
      "properties": {
        "validator_id": {
          "type": "string",
          "minLength": 1,
          "pattern": "\\S"
        },
        "command": {
          "type": [
            "string",
            "null"
          ]
        },
        "capabilities": {
          "$ref": "#/$defs/nonEmptyStringList"
        },
        "exit_code": {
          "type": "integer"
        },
        "result": {
          "enum": [
            "PASS",
            "FAIL",
            "TIMEOUT",
            "UNAVAILABLE",
            "BLOCKED"
          ]
        },
        "cache": {
          "enum": [
            "HIT",
            "MISS"
          ]
        },
        "duration_ms": {
          "type": "integer",
          "minimum": 0
        },
        "timeout_ms": {
          "type": "integer",
          "minimum": 100,
          "maximum": 600000
        },
        "cache_key": {
          "type": "string",
          "pattern": "^[0-9a-f]{64}$"
        },
        "cache_rejection": {
          "type": [
            "string",
            "null"
          ]
        },
        "runtime_version": {
          "type": "string",
          "minLength": 1,
          "pattern": "\\S"
        },
        "started_at": {
          "type": "string",
          "format": "date-time",
          "pattern": "^\\d{4}-\\d{2}-\\d{2}T\\d{2}:\\d{2}:\\d{2}(?:\\.\\d+)?Z$"
        },
        "ended_at": {
          "type": "string",
          "format": "date-time",
          "pattern": "^\\d{4}-\\d{2}-\\d{2}T\\d{2}:\\d{2}:\\d{2}(?:\\.\\d+)?Z$"
        },
        "forbidden_action": {
          "type": "string",
          "minLength": 1,
          "pattern": "\\S"
        }
      }
    },
    "gate": {
      "type": "object",
      "additionalProperties": false,
      "required": [
        "id",
        "status"
      ],
      "properties": {
        "id": {
          "type": "string",
          "minLength": 1,
          "pattern": "\\S"
        },
        "required": {
          "type": "boolean"
        },
        "status": {
          "enum": [
            "PASS",
            "FAIL",
            "UNVERIFIED",
            "NOT_REQUIRED"
          ]
        }
      }
    },
    "manualGate": {
      "type": "object",
      "additionalProperties": false,
      "required": [
        "id",
        "required",
        "status"
      ],
      "properties": {
        "id": {
          "type": "string",
          "minLength": 1,
          "pattern": "\\S"
        },
        "required": {
          "type": "boolean"
        },
        "status": {
          "enum": [
            "PASS",
            "FAIL",
            "UNVERIFIED",
            "NOT_REQUIRED"
          ]
        }
      }
    }
  },
  "x-tretnix-semantics": [
    "timestamps are ordered UTC values",
    "preflight OK has no issues",
    "context source count equals materialized sources",
    "unsupported plans identify missing capabilities",
    "cache hits and misses are disjoint",
    "task path requires a digest",
    "result is FAIL on automatic failure, REVIEW_REQUIRED on unresolved required manual gates, otherwise PASS"
  ]
}
